{"capture_phase":{"animation_fraction_milli":0,"id":"rain_state","state":"end_state"},"nodes":[{"actions":[{"action_id":"weather.page-changed","kind":"page_changed"}],"bounds_dp_q8_8":{"height":49152,"width":49152,"x":0,"y":0},"bounds_px":{"height":240,"width":240,"x":0,"y":0},"enabled":true,"id":"weather.rain-screen","label":"Imminent rain","parent_id":null,"role":"screen","state_description":"","token_roles":{"background":"background"},"value":"","visible":true},{"actions":[],"bounds_dp_q8_8":{"height":49152,"width":49152,"x":0,"y":0},"bounds_px":{"height":240,"width":240,"x":0,"y":0},"enabled":true,"id":"weather.rain-page","label":"Imminent rain","parent_id":"weather.rain-screen","role":"list","state_description":"","token_roles":{"layout":"surface"},"value":"","visible":true},{"actions":[],"bounds_dp_q8_8":{"height":14336,"width":15360,"x":3072,"y":1024},"bounds_px":{"height":70,"width":75,"x":15,"y":5},"enabled":true,"id":"weather.rain-hero","label":"Rain","parent_id":"weather.rain-page","role":"image","state_description":"","token_roles":{"asset":"weather_icon_registry","content":"semantic_tone"},"value":"","visible":true},{"actions":[],"bounds_dp_q8_8":{"height":14336,"width":26214,"x":21094,"y":1638},"bounds_px":{"height":70,"width":128,"x":103,"y":8},"enabled":true,"id":"weather.rain-headline","label":"","parent_id":"weather.rain-page","role":"list","state_description":"","token_roles":{"layout":"surface"},"value":"","visible":true},{"actions":[],"bounds_dp_q8_8":{"height":12288,"width":17613,"x":21094,"y":1638},"bounds_px":{"height":60,"width":86,"x":103,"y":8},"enabled":true,"id":"weather.rain-title","label":"Rain in 20 minutes","parent_id":"weather.rain-headline","role":"heading","state_description":"","token_roles":{"typography":"title"},"value":"","visible":true},{"actions":[],"bounds_dp_q8_8":{"height":2048,"width":19661,"x":21094,"y":13926},"bounds_px":{"height":10,"width":96,"x":103,"y":68},"enabled":true,"id":"weather.rain-duration","label":"Light rain for 35 min","parent_id":"weather.rain-headline","role":"text","state_description":"","token_roles":{"typography":"caption"},"value":"","visible":true},{"actions":[],"bounds_dp_q8_8":{"height":22938,"width":45875,"x":1638,"y":17613},"bounds_px":{"height":112,"width":224,"x":8,"y":86},"enabled":true,"id":"weather.rain-chart-card","label":"","parent_id":"weather.rain-page","role":"group","state_description":"","token_roles":{"container":"secondary","shape":"standard"},"value":"","visible":true},{"actions":[],"bounds_dp_q8_8":{"height":6963,"width":42598,"x":3277,"y":18842},"bounds_px":{"height":34,"width":208,"x":16,"y":92},"enabled":true,"id":"weather.rain-probability","label":"","parent_id":"weather.rain-chart-card","role":"list","state_description":"","token_roles":{"layout":"surface"},"value":"","visible":true},{"actions":[],"bounds_dp_q8_8":{"height":5120,"width":5120,"x":3277,"y":19866},"bounds_px":{"height":25,"width":25,"x":16,"y":97},"enabled":true,"id":"weather.rain-probability-icon","label":"Chance of rain","parent_id":"weather.rain-probability","role":"image","state_description":"","token_roles":{"asset":"weather_icon_registry","content":"semantic_tone"},"value":"","visible":true},{"actions":[],"bounds_dp_q8_8":{"height":6144,"width":10854,"x":9216,"y":19456},"bounds_px":{"height":30,"width":53,"x":45,"y":95},"enabled":true,"id":"weather.rain-probability-value","label":"32 percent","parent_id":"weather.rain-probability","role":"text","state_description":"","token_roles":{"typography":"numeral"},"value":"","visible":true},{"actions":[],"bounds_dp_q8_8":{"height":4915,"width":6963,"x":21504,"y":20070},"bounds_px":{"height":24,"width":34,"x":105,"y":98},"enabled":true,"id":"weather.rain-probability-label","label":"Chance\nof rain","parent_id":"weather.rain-probability","role":"text","state_description":"","token_roles":{"typography":"caption"},"value":"","visible":true},{"actions":[],"bounds_dp_q8_8":{"height":11264,"width":42598,"x":3277,"y":26214},"bounds_px":{"height":55,"width":208,"x":16,"y":128},"enabled":true,"id":"weather.rain-bars","label":"Rain chance peaks near 72 percent in 30 minutes","parent_id":"weather.rain-chart-card","role":"image","state_description":"","token_roles":{"series":"primary"},"value":"","visible":true},{"actions":[],"bounds_dp_q8_8":{"height":2048,"width":42598,"x":3277,"y":38298},"bounds_px":{"height":10,"width":208,"x":16,"y":187},"enabled":true,"id":"weather.rain-times","label":"","parent_id":"weather.rain-chart-card","role":"list","state_description":"","token_roles":{"layout":"surface"},"value":"","visible":true},{"actions":[],"bounds_dp_q8_8":{"height":2048,"width":10650,"x":3277,"y":38298},"bounds_px":{"height":10,"width":52,"x":16,"y":187},"enabled":true,"id":"weather.rain-time-now","label":"NOW","parent_id":"weather.rain-times","role":"text","state_description":"","token_roles":{"typography":"caption"},"value":"","visible":true},{"actions":[],"bounds_dp_q8_8":{"height":2048,"width":10650,"x":13926,"y":38298},"bounds_px":{"height":10,"width":52,"x":68,"y":187},"enabled":true,"id":"weather.rain-time-20","label":"20m","parent_id":"weather.rain-times","role":"text","state_description":"","token_roles":{"typography":"caption"},"value":"","visible":true},{"actions":[],"bounds_dp_q8_8":{"height":2048,"width":10650,"x":24576,"y":38298},"bounds_px":{"height":10,"width":52,"x":120,"y":187},"enabled":true,"id":"weather.rain-time-40","label":"40m","parent_id":"weather.rain-times","role":"text","state_description":"","token_roles":{"typography":"caption"},"value":"","visible":true},{"actions":[],"bounds_dp_q8_8":{"height":2048,"width":10650,"x":35226,"y":38298},"bounds_px":{"height":10,"width":52,"x":172,"y":187},"enabled":true,"id":"weather.rain-time-60","label":"60m","parent_id":"weather.rain-times","role":"text","state_description":"","token_roles":{"typography":"caption"},"value":"","visible":true},{"actions":[],"bounds_dp_q8_8":{"height":12288,"width":49152,"x":0,"y":36864},"bounds_px":{"height":60,"width":240,"x":0,"y":180},"enabled":true,"id":"weather.rain-actions","label":"","parent_id":"weather.rain-page","role":"list","state_description":"","token_roles":{"layout":"surface"},"value":"","visible":true},{"actions":[{"action_id":"weather.rain-details","kind":"tap"}],"bounds_dp_q8_8":{"height":12288,"width":33997,"x":0,"y":36864},"bounds_px":{"height":60,"width":166,"x":0,"y":180},"enabled":true,"id":"weather.rain-details","label":"Show weather details","parent_id":"weather.rain-actions","role":"button","state_description":"","token_roles":{"container":"primary","content":"on_surface"},"value":"","visible":true},{"actions":[{"action_id":"weather.retry","kind":"tap"}],"bounds_dp_q8_8":{"height":12288,"width":15155,"x":33997,"y":36864},"bounds_px":{"height":60,"width":74,"x":166,"y":180},"enabled":true,"id":"weather.rain-status","label":"Weather updated now","parent_id":"weather.rain-actions","role":"button","state_description":"","token_roles":{"container":"transparent","content":"on_surface"},"value":"","visible":true}],"physical_height_px":240,"physical_width_px":240,"profile_id":"watch_square_240","renderer":{"build_sha256":"a481a7e07abe8f335c4372f56fcc7386fb003970757f308ea99e959f3a290d85","kind":"lvgl","mode":"simulator","version":"9.5.0"},"schema_version":1,"snapshot_sha256":"7df1200933596ea132f4f288ead3edd175dbbdbc95dfb8740c9597c3b7c10356"}